{
    "template_id":  "music_production",
    "display_name":  "Music Production",
    "version":  "1.0.0",
    "goal_definition":  "Produce and release a polished music project with cohesive branding and audience growth loops.",
    "coordinator_agent":  {
                              "required":  true,
                              "role":  "Coordinator Agent",
                              "system_prompt_profile":  "hiveforge_coordinator_v1",
                              "system_prompt_path":  "agents/prompts/coordinator_system_prompt.md"
                          },
    "subordinate_agents":  [
                               {
                                   "role":  "Producer",
                                   "alias":  "Studio Producer",
                                   "required":  true,
                                   "personality_prompt_paths":  [
                                                                    "../agency-agents/project-management/project-management-studio-producer.md"
                                                                ]
                               },
                               {
                                   "role":  "Composer",
                                   "required":  true,
                                   "personality_prompt_paths":  [
                                                                    "../agency-agents/game-development/game-audio-engineer.md"
                                                                ]
                               },
                               {
                                   "role":  "Lyricist",
                                   "alias":  "Content Creator",
                                   "required":  true,
                                   "personality_prompt_paths":  [
                                                                    "../agency-agents/marketing/marketing-content-creator.md"
                                                                ]
                               },
                               {
                                   "role":  "Mixing Engineer",
                                   "required":  true,
                                   "personality_prompt_paths":  [
                                                                    "../agency-agents/game-development/game-audio-engineer.md"
                                                                ]
                               },
                               {
                                   "role":  "Marketing",
                                   "alias":  "Social Media Strategist",
                                   "required":  true,
                                   "personality_prompt_paths":  [
                                                                    "../agency-agents/marketing/marketing-social-media-strategist.md"
                                                                ]
                               },
                               {
                                   "role":  "Visual Designer",
                                   "alias":  "Image Prompt Engineer",
                                   "required":  true,
                                   "personality_prompt_paths":  [
                                                                    "../agency-agents/design/design-image-prompt-engineer.md"
                                                                ]
                               }
                           ],
    "optional_agents":  [
                            "Brand Guardian",
                            "Paid Social Strategist",
                            "TikTok Strategist",
                            "Instagram Curator",
                            "Legal Compliance Checker"
                        ],
    "workflow_definition":  {
                                "phases":  [
                                               "concept",
                                               "composition",
                                               "production",
                                               "release",
                                               "promotion"
                                           ],
                                "heartbeat_enabled":  true
                            },
    "task_breakdown":  [
                           {
                               "id":  "MUS-1",
                               "title":  "Define sonic direction and release goals",
                               "phase":  "concept"
                           },
                           {
                               "id":  "MUS-2",
                               "title":  "Write compositions and lyrics",
                               "phase":  "composition"
                           },
                           {
                               "id":  "MUS-3",
                               "title":  "Record, mix, and master tracks",
                               "phase":  "production"
                           },
                           {
                               "id":  "MUS-4",
                               "title":  "Prepare release assets and distribution",
                               "phase":  "release"
                           },
                           {
                               "id":  "MUS-5",
                               "title":  "Run social campaigns and audience analysis",
                               "phase":  "promotion"
                           }
                       ],
    "dependency_graph":  {
                             "MUS-1":  [

                                       ],
                             "MUS-2":  [
                                           "MUS-1"
                                       ],
                             "MUS-3":  [
                                           "MUS-2"
                                       ],
                             "MUS-4":  [
                                           "MUS-3"
                                       ],
                             "MUS-5":  [
                                           "MUS-4"
                                       ]
                         }
}

