{
    "template_id":  "content_creator",
    "display_name":  "Content Creator",
    "version":  "1.0.0",
    "goal_definition":  "Run a high-throughput content pipeline that grows audience, engagement, and monetization across channels.",
    "coordinator_agent":  {
                              "required":  true,
                              "role":  "Coordinator Agent",
                              "system_prompt_profile":  "hiveforge_coordinator_v1",
                              "system_prompt_path":  "agents/prompts/coordinator_system_prompt.md"
                          },
    "subordinate_agents":  [
                               {
                                   "role":  "Scriptwriter",
                                   "alias":  "Content Creator",
                                   "required":  true,
                                   "personality_prompt_paths":  [
                                                                    "../agency-agents/marketing/marketing-content-creator.md"
                                                                ]
                               },
                               {
                                   "role":  "Editor",
                                   "alias":  "Reality Checker",
                                   "required":  true,
                                   "personality_prompt_paths":  [
                                                                    "../agency-agents/testing/testing-reality-checker.md"
                                                                ]
                               },
                               {
                                   "role":  "Thumbnail Designer",
                                   "alias":  "Image Prompt Engineer",
                                   "required":  true,
                                   "personality_prompt_paths":  [
                                                                    "../agency-agents/design/design-image-prompt-engineer.md"
                                                                ]
                               },
                               {
                                   "role":  "SEO Specialist",
                                   "required":  true,
                                   "personality_prompt_paths":  [
                                                                    "../agency-agents/marketing/marketing-seo-specialist.md"
                                                                ]
                               },
                               {
                                   "role":  "Social Media Manager",
                                   "alias":  "Social Media Strategist",
                                   "required":  true,
                                   "personality_prompt_paths":  [
                                                                    "../agency-agents/marketing/marketing-social-media-strategist.md"
                                                                ]
                               }
                           ],
    "optional_agents":  [
                            "TikTok Strategist",
                            "Instagram Curator",
                            "LinkedIn Content Creator",
                            "Brand Guardian"
                        ],
    "operating_mode":  "continuous_business",
    "recurring_loops":  [
                            {
                                "key":  "creator_publish_loop",
                                "title":  "Publish cross-channel content batch and distribution checks",
                                "phase":  "distribution",
                                "owner_role":  "Social Media Strategist",
                                "every_ms":  10800000,
                                "enabled":  true
                            },
                            {
                                "key":  "creator_analytics_loop",
                                "title":  "Review engagement metrics and adjust hooks",
                                "phase":  "analytics",
                                "owner_role":  "SEO Specialist",
                                "every_ms":  10800000,
                                "enabled":  true
                            }
                        ],
    "auto_staffing_policy":  {
                                 "enabled":  true,
                                 "cooldown_minutes":  45,
                                 "backlog_per_agent_threshold":  2,
                                 "max_optional_adds":  3,
                                 "max_agents":  12
                             },
    "workflow_definition":  {
                                "phases":  [
                                               "planning",
                                               "production",
                                               "optimization",
                                               "distribution",
                                               "analytics"
                                           ],
                                "heartbeat_enabled":  true
                            },
    "task_breakdown":  [
                           {
                               "id":  "CNT-1",
                               "title":  "Build weekly content calendar",
                               "phase":  "planning"
                           },
                           {
                               "id":  "CNT-2",
                               "title":  "Produce scripts and media assets",
                               "phase":  "production"
                           },
                           {
                               "id":  "CNT-3",
                               "title":  "Apply SEO and packaging improvements",
                               "phase":  "optimization"
                           },
                           {
                               "id":  "CNT-4",
                               "title":  "Publish and cross-post to channels",
                               "phase":  "distribution"
                           },
                           {
                               "id":  "CNT-5",
                               "title":  "Review performance and iterate",
                               "phase":  "analytics"
                           }
                       ],
    "dependency_graph":  {
                             "CNT-1":  [

                                       ],
                             "CNT-2":  [
                                           "CNT-1"
                                       ],
                             "CNT-3":  [
                                           "CNT-2"
                                       ],
                             "CNT-4":  [
                                           "CNT-3"
                                       ],
                             "CNT-5":  [
                                           "CNT-4"
                                       ]
                         }
}

